{
  "format": "oracle41-data-provider-conformance",
  "version": 1,
  "provider_id": "goldrush",
  "operations": {
    "native_balance": {
      "responses": [
        {
          "method": "/v1/eth-mainnet/address/0xaaaaaaaaaaaaaaaaaaaaaaaaaaaaaaaaaaaaaaaa/balances_native/",
          "result": {"data": {"items": [{"native_token": true, "balance": "1000000000000000000", "contract_decimals": 18}]}, "error": false}
        }
      ]
    },
    "token_balances": {
      "responses": [
        {
          "method": "/v1/eth-mainnet/address/0xaaaaaaaaaaaaaaaaaaaaaaaaaaaaaaaaaaaaaaaa/balances_v2/",
          "result": {"data": {"items": [{"contract_address": "0xa0b86991c6218b36c1d19d4a2e9eb0ce3606eb48", "balance": "1230000", "contract_name": "USD Coin", "contract_ticker_symbol": "USDC", "contract_decimals": 6, "is_spam": false}]}, "error": false}
        }
      ]
    },
    "activity": {
      "responses": [
        {
          "method": "/v1/eth-mainnet/address/0xaaaaaaaaaaaaaaaaaaaaaaaaaaaaaaaaaaaaaaaa/transactions_v3/page/0/",
          "result": {"data": {"items": [{"tx_hash": "0xactivity", "block_height": 4660, "block_signed_at": "2026-01-20T10:00:00Z", "value": "0", "log_events": [{"tx_hash": "0xactivity", "block_height": 4660, "block_signed_at": "2026-01-20T10:00:00Z", "log_offset": 1, "sender_address": "0xa0b86991c6218b36c1d19d4a2e9eb0ce3606eb48", "sender_contract_ticker_symbol": "USDC", "sender_contract_decimals": 6, "supports_erc": ["erc20"], "decoded": {"name": "Transfer", "params": [{"name": "from", "value": "0xaaaaaaaaaaaaaaaaaaaaaaaaaaaaaaaaaaaaaaaa"}, {"name": "to", "value": "0xbbbbbbbbbbbbbbbbbbbbbbbbbbbbbbbbbbbbbbbb"}, {"name": "value", "value": "1500000"}]}}]}], "links": {"next": "page-2"}}, "error": false}
        }
      ]
    },
    "token_history": {
      "responses": [
        {
          "method": "/v1/eth-mainnet/address/0xaaaaaaaaaaaaaaaaaaaaaaaaaaaaaaaaaaaaaaaa/transactions_v3/page/0/",
          "result": {"data": {"items": [{"tx_hash": "0xnfts", "block_height": 8193, "block_signed_at": "2026-01-20T10:01:00Z", "value": "0", "log_events": [{"log_offset": 1, "sender_address": "0x9999999999999999999999999999999999999999", "sender_contract_ticker_symbol": "NFT", "supports_erc": ["erc721"], "decoded": {"name": "Transfer", "params": [{"name": "from", "value": "0xaaaaaaaaaaaaaaaaaaaaaaaaaaaaaaaaaaaaaaaa"}, {"name": "to", "value": "0xbbbbbbbbbbbbbbbbbbbbbbbbbbbbbbbbbbbbbbbb"}, {"name": "tokenId", "value": "123"}]}}, {"log_offset": 2, "sender_address": "0x9999999999999999999999999999999999999999", "sender_contract_ticker_symbol": "NFT", "supports_erc": ["erc1155"], "decoded": {"name": "TransferSingle", "params": [{"name": "from", "value": "0xaaaaaaaaaaaaaaaaaaaaaaaaaaaaaaaaaaaaaaaa"}, {"name": "to", "value": "0xcccccccccccccccccccccccccccccccccccccccc"}, {"name": "id", "value": "1"}, {"name": "value", "value": "3"}]}}]}], "links": {"next": null}}, "error": false}
        }
      ]
    }
  },
  "expected": {
    "native_balance": "1",
    "token_balance_symbol": "USDC",
    "token_balance": "1.23",
    "token_balance_has_next": false,
    "activity_hash": "0xactivity",
    "activity_value": "1.5",
    "token_history_categories": ["erc721", "erc1155"]
  }
}
